Flipped journal;control journal;discipline
Oncology Reviews;Psychopharmakotherapie;MEDI
Onderstepoort Journal of Veterinary Research;Journal of Camel Practice and Research;VETE
Organon F;Literature And Theology;ARTS
Parasite;Central European journal of public health;MEDI
Parasite;JOURNAL OF TROPICAL FOREST SCIENCE;AGRI
Parasite;Journal of Camel Practice and Research;VETE
Parasite;Korean Journal of Microbiology and Biotechnology;IMMU
Petrology;Psychiatrie;EART
Pharmacia;Alcoholism;MEDI
Pharmacia;Australian Journal of Rehabilitation Counselling;HEAL
Pharmacia;Indian Journal of Agricultural Biochemistry;BIOC
Pharmacia;PharmacoEconomics - Italian Research Articles;PHAR
Philosophical Investigations;Journal Of Semitic Studies;ARTS
Polar Research;GEOARCHAEOLOGY;EART
Polar Research;Policy and Politics;ENVI
Polimery w Medycynie;Journal of Ecophysiology and Occupational Health;MEDI
Polish Journal of Pathology;International Journal of Health Planning and Management;HEAL
Polish Journal of Pathology;Journal of Southern History;MEDI
Polish Polar Research;Journal of International Wildlife Law and Policy;ENVI
Polish Polar Research;Marine Fisheries Review;AGRI
Pomorstvo;Process Engineering;ENGI
Pomorstvo;Psychology and Education;SOCI
Post?py Higieny i Medycyny Do?wiadczalnej;Occupational Therapy in Health Care;MEDI
Prague Medical Report;Pathologica;MEDI
Progress in Natural Science: Materials International;Galvanotechnik;MATE
Progress in Natural Science: Materials International;scientific american;MULT
Progress in Orthodontics;European Journal Of Dental Education;DENT
Progress in Orthodontics;European Science Editing;MEDI
Promet (Zagreb);International Journal of Performability Engineering;ENGI
Promet (Zagreb);NURSE EDUCATOR;SOCI
Przegl?d Dermatologiczny;Neuro-ophthalmology;MEDI
Psychologica Belgica;International Journal of Aviation Psychology;PSYC
Public Policy and Administration;Ethics and International Affairs;SOCI
Quaestiones Geographicae;Geotechnik;EART
Radiology and Oncology;Journal of Ecophysiology and Occupational Health;MEDI
Reumatismo;Alcoholism;MEDI
Revista Argentina de Dermatolog¡a;Savoirs et clinique;MEDI
Revista Argentina de Microbiolog¡a;Journal of The American Society of Brewing Chemists;IMMU
Revista Argentina de Microbiolog¡a;Occupational Therapy in Health Care;MEDI
Revista Brasileira de Anestesiologia;Journal of Communicable Diseases;MEDI
Revista Brasileira de Oftalmologia;Ideggy¢gy szati Szemle;MEDI
Revista Brasileira de Otorrinolaringologia;NURSING;MEDI
Revista Espanola de Enfermedades Digestivas;Journal of Pediatric Ophthalmology and Strabismus;MEDI
Revista Ga£cha de Enfermagem ;Acta chirurgica Iugoslavica;MEDI
Revista Portuguesa de Cardiologia;Heart Surgery Forum;MEDI
Revista de Dialectologia y Tradiciones Populares;Forum Italicum;SOCI
Revista de Dialectologia y Tradiciones Populares;Journal of the Midwest Modern Language Association;ARTS
Revista de Gastroenterolog¡a de M‚xico;Gulhane Medical Journal;MEDI
Revista de Indias;Journal of Rural Development;SOCI
Revista de Indias;Shenandoah;ARTS
Revista de Literatura;Journal Of The History Of Collections;ARTS
Revista de Metalurgia;High Temperature Material Processes;CHEM
Revista de Metalurgia;High Temperature Material Processes;MATE
Revista de Metalurgia;Lasers in Engineering;PHYS
Revista de Nefrolog¡a, Di lisis y Trasplante;Chinesische Medizin;MEDI
Revista de la Facultad de Ciencias M‚dicas de C¢rdoba;Research in the Sociology of Health Care;MEDI
Revue de G‚ographie Alpine;Journal Of Environmental Law;EART
Revue de G‚ographie Alpine;Journal of Pacific History;SOCI
Rheumatology;Aids Research and Human Retroviruses;IMMU
Rheumatology;Muscle AND Nerve;NEUR
Rheumatology;REPRODUCTION;MEDI
Rice;European Review Of Agricultural Economics;AGRI
Rodrigu‚sia;JOURNAL OF TROPICAL FOREST SCIENCE;AGRI
Sarcoma;Australian Journal of Rehabilitation Counselling;MEDI
Saudi Pharmaceutical Journal;Psychopharmakotherapie;PHAR
Science and Technology of Advanced Materials;Fatigue and Fracture of Engineering Materials and Structures;MATE
Scientia Marina;Journal Of Molluscan Studies;AGRI
Scientia Marina;SOIL SCIENCE;EART
Scientia Pharmaceutica;Dermatologie in Beruf und Umwelt;PHAR
Sefarad;Canadian Journal of Law and Society;SOCI
Sefarad;Journal Of The History Of Collections;ARTS
Slavisti?na Revija;Forum For Modern Language Studies;ARTS
Slavisti?na Revija;Osteuropa;SOCI
Social Sciences;Educational Leadership;SOCI
Society;International Journal for the Semiotics of Law;SOCI
Sociologia;HERMES;SOCI
South African Journal of Business Management;Advances in Business Marketing and Purchasing;BUSI
South African Journal of Communication Disorders;Chinesische Medizin;MEDI
South African Journal of Economic and Management Sciences;Betriebswirtschaftliche Forschung und Praxis;BUSI
South African Journal of Economic and Management Sciences;Betriebswirtschaftliche Forschung und Praxis;ECON
South African Journal of Obstetrics and Gynaecology;Chinesische Medizin;MEDI
South African Journal of Science;BOLETIN GEOLOGICO Y MINERO;EART
South African Journal of Science;lab Animal;AGRI
South African Journal of Science;lab Animal;BIOC
South African Medical Journal;Pediatric Emergency care;MEDI
Southern African Journal of HIV Medicine;plastic Surgical Nursing;MEDI
Srpski Arhiv za Celokupno Lekarstvo;Applied Radiology;MEDI
Studia Quaternaria;Austrian Journal of Earth sciences;EART
Studies in Mycology;European Review Of Agricultural Economics;AGRI
Tehni?ki Vjesnik;Howard Journal Of Communications;BUSI
Tehni?ki Vjesnik;Tribologia;ENGI
Tellus, Series A;Building Research and Information;ENGI
Tellus, Series A;Chemie der Erde;EART
Tellus, Series A;Environmental toxicology;ENVI
Tempo;Landscape Architecture;ARTS
The Journal of Headache and Pain;American Journal of Alzheimer's Disease and Other Dementias;NEUR
The Journal of Headache and Pain;International Journal of gynecological Pathology;MEDI
The Review of Regional Studies;Legacy;SOCI
The Review of Regional Studies;STANDORT;EART
Tuberculosis and Respiratory Diseases;lab Animal;MEDI
Turkderm;Journal of the Bahrain Medical Society;MEDI
Upsala Journal of Medical Sciences;Journal of Forensic Psychiatry and Psychology;MEDI
Veterinary Research;MEDICAL CARE;MEDI
Veterinary Research;lab Animal;VETE
Veterinary research;Journal of Child Psychology and Psychiatry and Allied Disciplines;MEDI
Veterinary research;lab Animal;VETE
Veterin rn¡ Medic¡na;Journal of Camel Practice and Research;VETE
Vojnosanitetski Pregled;Vestnik Rentgenologii i Radiologii;MEDI
Voluntas;Group Dynamics;BUSI
Voluntas;International review of social history;SOCI
Voluntas;Marine Georesources and Geotechnology;EART
Water;BOLETIN GEOLOGICO Y MINERO;EART
Water;Chemical Engineering;CENG
Water;Revue de Pneumologie Clinique;MEDI
Water;Wasserwirtschaft;ENVI
Water;Wasserwirtschaft;SOCI
Water;lab Animal;AGRI
Water;lab Animal;BIOC
Water S.A.;Ozone: Science and Engineering;ENVI
Water S.A.;Voprosy Virusologii;IMMU
Wildfowl;Disaster Prevention and Management;ENVI
Wildfowl;Nautilus;AGRI
Yonsei Medical Journal;Pediatric Emergency care;MEDI
Zeitschrift fur Psychologie;European Journal of the History of Economic Thought;ARTS
Zeitschrift fur Psychologie;Nonlinear Dynamics, Psychology, and Life Sciences;PSYC
???????? ????????;Breast Diseases;MEDI
